{
  "$schema": "https://json-schema.org/draft/2020-12/schema",
  "$id": "https://bunny-os.invalid/schemas/cve-analysis.schema.json",
  "title": "Bunny OS per-CVE binary and reachability analysis",
  "description": "One record per Critical or High advisory. 'unknown' is a first-class value: a field that was not measured must say so rather than be omitted, because an absent field and a deliberate 'we do not know' are different claims.",
  "type": "object",
  "additionalProperties": false,
  "required": [
    "schemaVersion",
    "advisoryId",
    "cveId",
    "packageName",
    "sourcePackage",
    "binaryPackage",
    "installedVersion",
    "fixedVersion",
    "installedExecutableOrLibrary",
    "sourceRpmReference",
    "debuginfoReference",
    "elfBuildId",
    "strippedState",
    "exportedSymbols",
    "dynamicDependencies",
    "packageScripts",
    "systemdUnits",
    "socketUnits",
    "dbusActivation",
    "desktopActivation",
    "commandInvocationPaths",
    "bunnyInvocationPaths",
    "pluginInvocationPaths",
    "sandboxReachability",
    "userInvocability",
    "networkExposure",
    "defaultEnablement",
    "vulnerableFunctionOrSubsystem",
    "mapping",
    "evidenceSource",
    "conclusion"
  ],
  "properties": {
    "schemaVersion": { "const": 1 },
    "advisoryId": { "type": "string", "pattern": "^(CVE-[0-9]{4}-[0-9]{4,}|GHSA-[0-9a-z]{4}-[0-9a-z]{4}-[0-9a-z]{4}|GO-[0-9]{4}-[0-9]+)$" },
    "cveId": { "type": "string" },
    "packageName": { "type": "string", "minLength": 1 },
    "sourcePackage": { "type": "string", "minLength": 1 },
    "binaryPackage": { "type": "string", "minLength": 1 },
    "installedVersion": { "type": "string", "minLength": 1 },
    "fixedVersion": { "type": ["string", "null"] },
    "installedExecutableOrLibrary": { "type": "string", "minLength": 1 },
    "carrierObjects": { "type": "array", "items": { "type": "string" } },
    "candidateCarriers": { "type": "array", "items": { "type": "string" } },
    "sourceRpmReference": { "type": "string" },
    "debuginfoReference": { "type": "string" },
    "debugsourceReference": { "type": "string" },
    "elfBuildId": { "type": "string" },
    "strippedState": { "enum": ["stripped", "not-stripped", "partially-stripped", "unknown"] },
    "language": { "type": "string" },
    "exportedSymbols": { "type": "array", "items": { "type": "string" } },
    "dynamicDependencies": { "type": "array", "items": { "type": "string" } },
    "packageScripts": { "type": "string" },
    "systemdUnits": { "type": "array", "items": { "type": "string" } },
    "socketUnits": { "type": "array", "items": { "type": "string" } },
    "dbusActivation": { "enum": ["yes", "no", "unknown"] },
    "desktopActivation": { "enum": ["yes", "no", "unknown"] },
    "desktopActivationEvidence": { "type": "array", "items": { "type": "string" } },
    "commandInvocationPaths": { "type": "array", "items": { "type": "string" } },
    "bunnyInvocationPaths": { "type": "array", "items": { "type": "string" } },
    "pluginInvocationPaths": { "type": "array", "items": { "type": "string" } },
    "sandboxReachability": { "enum": ["yes", "no", "unknown"] },
    "userInvocability": { "enum": ["yes", "no", "unknown"] },
    "networkExposure": { "type": "string" },
    "defaultEnablement": { "enum": ["yes", "no", "unknown"] },
    "vulnerableFunctionOrSubsystem": { "type": "string" },
    "sourcePackageVersion": { "type": "string" },
    "buildConfiguration": { "type": "string" },
    "symbolOrSourceMapping": { "type": "string" },
    "activationAnalysis": { "type": "string" },
    "privilegeAnalysis": { "type": "string" },
    "invocationGraph": { "type": "string" },
    "systemConfiguration": { "type": "string" },
    "sandboxOrMacControl": { "type": "string" },
    "exactMitigation": { "type": "string" },
    "bypassAnalysis": { "type": "string" },
    "residualImpact": { "type": "string" },
    "mapping": {
      "type": "object",
      "additionalProperties": false,
      "required": [
        "vulnerableSourceFile",
        "vulnerableFunction",
        "affectedFeature",
        "buildTimeFlag",
        "runtimeFlag",
        "commandRequiredToReach",
        "privilegeRequired",
        "inputType",
        "networkRequirement",
        "localUserRequirement",
        "containerOrImageRequirement",
        "bunnyExposesFeature"
      ],
      "properties": {
        "vulnerableSourceFile": { "type": "string" },
        "vulnerableFunction": { "type": "string" },
        "affectedFeature": { "type": "string" },
        "buildTimeFlag": { "type": "string" },
        "runtimeFlag": { "type": "string" },
        "commandRequiredToReach": { "type": "string" },
        "privilegeRequired": { "type": "string" },
        "inputType": { "type": "string" },
        "networkRequirement": { "type": "string" },
        "localUserRequirement": { "type": "string" },
        "containerOrImageRequirement": { "type": "string" },
        "bunnyExposesFeature": { "type": "string" }
      }
    },
    "evidenceSource": { "type": "string", "minLength": 1 },
    "conclusion": {
      "enum": [
        "Not present",
        "Present but unreachable",
        "Reachable but mitigated",
        "Reachable and blocking",
        "Unknown"
      ]
    },
    "reviewer": { "type": ["string", "null"] },
    "independentReviewReference": { "type": ["string", "null"] },
    "sourceCommit": { "type": "string", "pattern": "^[0-9a-f]{40}$" },
    "generatedAt": { "type": "string" },
    "notes": { "type": "string" }
  }
}
