{
  "advisoryId": "GHSA-4c29-8rgm-jvjj",
  "binaryPackage": "unknown",
  "bunnyInvocationPaths": [
    "none \u2014 the privileged broker exposes typed fixed backends and has no generic exec path; no backend invokes a container runtime"
  ],
  "candidateCarriers": [
    "podman-5.8.4-1.fc44.x86_64 at /usr/sbin/podman",
    "skopeo-1.22.2-2.fc44.x86_64 at /usr/sbin/skopeo",
    "bootc-1.16.4-1.fc44.x86_64 at /usr/sbin/bootc"
  ],
  "carrierObjects": [
    "/sysroot/ostree/repo/objects/8c/c9b0248b19238b5f375ee6f7c986efc7ef8cdd360140254e41c478cd91b933.file"
  ],
  "commandInvocationPaths": [
    "/usr/sbin/podman \u2014 mode 0755 root:root, no setuid; on PATH for any user",
    "/usr/sbin/skopeo \u2014 mode 0755 root:root, no setuid",
    "/usr/sbin/bootc \u2014 mode 0755 root:root, no setuid"
  ],
  "conclusion": "Unknown",
  "cveId": "unknown",
  "dbusActivation": "unknown",
  "debuginfoReference": "unknown",
  "debugsourceReference": "unknown",
  "defaultEnablement": "no",
  "desktopActivation": "no",
  "desktopActivationEvidence": [
    "grep '^Exec=.*(podman|skopeo|bootc|toolbox|docker)' over every shipped .desktop at 79bb99ddb39d: no match"
  ],
  "dynamicDependencies": [],
  "elfBuildId": "unknown",
  "evidenceSource": "evidence/vulnerability/beta-grype.json (carrier object), evidence/reachability/beta-facts.txt (unit state), evidence/reachability/beta-permissions.txt (modes), evidence/reachability/beta-minimised-binaries.txt (installed NEVRAs)",
  "exportedSymbols": [],
  "fixedVersion": "0.28.1",
  "generatedAt": "2026-07-30T14:49:43.432473Z",
  "independentReviewReference": null,
  "installedExecutableOrLibrary": "/sysroot/ostree/repo/objects/8c/c9b0248b19238b5f375ee6f7c986efc7ef8cdd360140254e41c478cd91b933.file",
  "installedVersion": "v0.25.1",
  "language": "go",
  "mapping": {
    "affectedFeature": "unknown",
    "buildTimeFlag": "unknown",
    "bunnyExposesFeature": "no",
    "commandRequiredToReach": "unknown",
    "containerOrImageRequirement": "unknown",
    "inputType": "unknown",
    "localUserRequirement": "yes",
    "networkRequirement": "none",
    "privilegeRequired": "unprivileged-user",
    "runtimeFlag": "unknown",
    "vulnerableFunction": "unknown",
    "vulnerableSourceFile": "unknown"
  },
  "networkExposure": "none",
  "notes": "The scan records the carrier as an ostree object, not an installed path: the fedora-bootc base ships an object store and every finding's location is an object in a lower layer. Carrier object: /sysroot/ostree/repo/objects/8c/c9b0248b19238b5f375ee6f7c986efc7ef8cdd360140254e41c478cd91b933.file. Mapping that object to one of the three installed Go binaries requires the image: `ostree ls` or `find /usr -samefile` inside a booted or mounted deployment. Until that is done the carrier is one of: podman-5.8.4-1.fc44.x86_64 at /usr/sbin/podman; skopeo-1.22.2-2.fc44.x86_64 at /usr/sbin/skopeo; bootc-1.16.4-1.fc44.x86_64 at /usr/sbin/bootc.",
  "packageName": "github.com/moby/buildkit",
  "packageScripts": "unknown",
  "pluginInvocationPaths": [
    "none \u2014 plugins reach the system only through the broker"
  ],
  "reviewer": null,
  "sandboxReachability": "yes",
  "schemaVersion": 1,
  "socketUnits": [
    "podman.socket \u2014 ListenStream=%t/podman/podman.sock, unix, absent from sockets.target.wants"
  ],
  "sourceCommit": "79bb99ddb39d8a5dbc279629f43b23346fb0e5e8",
  "sourcePackage": "unknown",
  "sourceRpmReference": "unknown",
  "strippedState": "unknown",
  "systemdUnits": [
    "podman.service (present, not enabled)",
    "podman.socket (present, not in sockets.target.wants)",
    "bootc-fetch-apply-updates.timer (present, not enabled)"
  ],
  "userInvocability": "yes",
  "vulnerableFunctionOrSubsystem": "unknown"
}
